{
  "id": "interface.healthz-get-api",
  "title": "Healthz Get API Contract",
  "description": "Draft USF-native interface contract for GET /healthz. It promotes the implemented local route metadata into canonical interface-contract coverage while preserving OpenAPI as a lower-authority projection.",
  "authorityLevel": "semantic-definition",
  "lifecycleState": "draft",
  "ontologyConcepts": [
    "Interface",
    "Service",
    "Port"
  ],
  "taxonomyRefs": [
    "interface-classification"
  ],
  "vocabularyRefs": [
    "interface-kinds"
  ],
  "aiGuidance": "Treat this interface contract as the route authority. Do not infer semantic authority from OpenAPI, route metadata, examples, generated reports, or handler structure.",
  "interfaceKind": "api-route",
  "purpose": "Represent healthz.get as a governed GET API route contract for runtime-health.",
  "boundary": "Local dev/test inbound HTTP boundary GET /healthz; implementation path apps/api/src/server.ts; route classification health-readiness.",
  "semanticContractRef": "semantic-contract.serverless-function-runtime",
  "requestContract": {
    "description": "Request semantics for healthz.get bind method, path, operation id, request schema, auth scheme, tenant scope, and required action before implementation handling. Request schema: none.",
    "fields": [
      "routeId:healthz.get",
      "method:GET",
      "path:/healthz",
      "openapiOperationId:getHealthz",
      "requestSchema:none",
      "authScheme:none",
      "tenantScope:none",
      "requiredAction:none"
    ]
  },
  "responseContract": {
    "description": "Response semantics for healthz.get expose 200 HealthResponse; error responses use ApiErrorResponse. Audit, PDP, idempotency, rate-limit, correlation, field exposure, observability, gateway, and proof boundaries remain explicit contract terms.",
    "fields": [
      "responseSchema:200:HealthResponse",
      "errorSchema:ApiErrorResponse",
      "auditPolicy:not audited; no tenant or sensitive data",
      "pdpPolicy:public health/readiness route; no tenant or PDP input",
      "proofEvidenceStatus:bounded-local-dev-test-no-public-api-claim"
    ]
  },
  "permissions": [
    "route-access:none"
  ],
  "security": "Auth scheme none; tenant scope none; PDP policy public health/readiness route; no tenant or PDP input; audit policy not audited; no tenant or sensitive data; idempotency policy not-required; pagination policy none; rate-limit policy local-dev-test health probe; live edge rate limit deferred; field exposure policy public runtime posture only; no internals; observability policy request_count error_count latency local counters only; gateway policy local-dev-test-only gateway-edge-waf-tls-production-posture-deferred; error schema ApiErrorResponse; proof status is bounded local-dev-test evidence with no public API or live-provider claim.",
  "driftDetectable": true,
  "sourceRefs": [
    "packages/contracts/src/api-surface.ts#routeId=healthz.get",
    "packages/openapi/openapi.json#operationId=getHealthz",
    "apps/api/src/server.ts"
  ]
}
